{
  "type": "architecture",
  "title": "flow-powers — the compounding loop",
  "nodes": [
    { "id": "kb", "label": "flow KB", "cat": "database", "row": 0, "col": 0 },
    { "id": "brainstorm", "label": "brainstorm", "cat": "backend", "row": 0, "col": 1 },
    { "id": "plan", "label": "writing-plans", "cat": "backend", "row": 0, "col": 2 },
    { "id": "build", "label": "gated build", "cat": "backend", "row": 0, "col": 3 },
    { "id": "finish", "label": "finish (PR)", "cat": "backend", "row": 0, "col": 4 },
    { "id": "done", "label": "flow done sweep", "cat": "security", "row": 1, "col": 2 }
  ],
  "edges": [
    { "from": "kb", "to": "brainstorm", "label": "warm start", "kind": "happy" },
    { "from": "brainstorm", "to": "plan" },
    { "from": "plan", "to": "build" },
    { "from": "build", "to": "finish" },
    { "from": "finish", "to": "done", "label": "close", "kind": "happy" },
    { "from": "done", "to": "kb", "label": "grows KB", "kind": "happy", "fromSide": "bottom", "toSide": "bottom" }
  ]
}
